{
  "dataset": "project_bit_historical_timeline",
  "dataset_version": "0.1.0",
  "year": 1983,
  "month": 5,
  "period": "1983-05",
  "events": [
    {
      "id": "1983-05-16-motown-25-airs-on-television",
      "date": "1983-05-16",
      "date_precision": "day",
      "known_as_of": "1983-05-16",
      "category": "pop_culture",
      "scope": "US",
      "headline": "Motown 25 airs on television",
      "summary": "The anniversary special broadcasts Michael Jackson's celebrated 'Billie Jean' performance to a national audience.",
      "tags": [
        "Motown 25",
        "Michael Jackson",
        "television"
      ],
      "economic_sectors": [
        "music",
        "media"
      ],
      "game_relevance": [
        "consumer_attention",
        "period_flavor"
      ],
      "importance": 4,
      "source_keys": [
        "wiki_1983"
      ]
    },
    {
      "id": "1983-05-25-return-of-the-jedi-opens",
      "date": "1983-05-25",
      "date_precision": "day",
      "known_as_of": "1983-05-25",
      "category": "pop_culture",
      "scope": "US",
      "headline": "Return of the Jedi opens",
      "summary": "The third released Star Wars film becomes one of the year's biggest entertainment events.",
      "tags": [
        "Star Wars",
        "film"
      ],
      "economic_sectors": [
        "entertainment",
        "media"
      ],
      "game_relevance": [
        "consumer_trends",
        "period_flavor"
      ],
      "importance": 4,
      "source_keys": [
        "wiki_1983"
      ]
    },
    {
      "id": "1983-05-economic-expansion-gains-pace",
      "date": "1983-05",
      "date_precision": "month",
      "known_as_of": "1983-05",
      "category": "economics",
      "scope": "US",
      "headline": "Economic expansion gains pace",
      "summary": "Consumer spending, housing, and production improve rapidly during the first full year of recovery.",
      "tags": [
        "economic recovery",
        "consumer spending"
      ],
      "economic_sectors": [
        "retail",
        "housing",
        "manufacturing"
      ],
      "game_relevance": [
        "growth_cycle",
        "consumer_sentiment"
      ],
      "importance": 4,
      "source_keys": [
        "fed_recession_8182"
      ]
    }
  ]
}