{
  "dataset": "project_bit_historical_timeline",
  "dataset_version": "0.1.0",
  "year": 1981,
  "month": 8,
  "period": "1981-08",
  "events": [
    {
      "id": "1981-08-01-mtv-begins-broadcasting",
      "date": "1981-08-01",
      "date_precision": "day",
      "known_as_of": "1981-08-01",
      "category": "pop_culture",
      "scope": "US",
      "headline": "MTV begins broadcasting",
      "summary": "Music Television launches in the United States, accelerating the importance of music videos and cable youth culture.",
      "tags": [
        "MTV",
        "music videos",
        "cable"
      ],
      "economic_sectors": [
        "media",
        "music"
      ],
      "game_relevance": [
        "media_shift",
        "consumer_trends"
      ],
      "importance": 5,
      "source_keys": [
        "wiki_1981"
      ]
    },
    {
      "id": "1981-08-03-patco-air-traffic-controllers-strike",
      "date": "1981-08-03",
      "date_precision": "day",
      "known_as_of": "1981-08-03",
      "category": "labor",
      "scope": "US",
      "headline": "PATCO air traffic controllers strike",
      "summary": "President Reagan orders striking federal air traffic controllers back to work and later fires those who refuse.",
      "tags": [
        "PATCO",
        "labor",
        "Reagan"
      ],
      "economic_sectors": [
        "airlines",
        "transportation"
      ],
      "game_relevance": [
        "labor",
        "airline_operations",
        "policy_change"
      ],
      "importance": 5,
      "source_keys": [
        "wiki_1981"
      ]
    },
    {
      "id": "1981-08-12-ibm-personal-computer-introduced",
      "date": "1981-08-12",
      "date_precision": "day",
      "known_as_of": "1981-08-12",
      "category": "technology",
      "scope": "US",
      "headline": "IBM Personal Computer introduced",
      "summary": "IBM launches the IBM PC, a milestone in the commercialization and standardization of personal computing.",
      "tags": [
        "IBM PC",
        "personal computers"
      ],
      "economic_sectors": [
        "technology",
        "semiconductors",
        "software"
      ],
      "game_relevance": [
        "tech_adoption",
        "sector_growth"
      ],
      "importance": 5,
      "source_keys": [
        "wiki_1981"
      ]
    },
    {
      "id": "1981-08-13-economic-recovery-tax-act-signed",
      "date": "1981-08-13",
      "date_precision": "day",
      "known_as_of": "1981-08-13",
      "category": "economics",
      "scope": "US",
      "headline": "Economic Recovery Tax Act signed",
      "summary": "Reagan signs a major tax-cut package that reduces individual income-tax rates over several years.",
      "tags": [
        "Reaganomics",
        "tax cuts"
      ],
      "economic_sectors": [
        "broad_market"
      ],
      "game_relevance": [
        "fiscal_policy",
        "consumer_spending"
      ],
      "importance": 5,
      "source_keys": [
        "wiki_1981"
      ]
    }
  ]
}