{
  "dataset": "project_bit_historical_timeline",
  "dataset_version": "0.1.0",
  "year": 1981,
  "month": 10,
  "period": "1981-10",
  "events": [
    {
      "id": "1981-10-01-first-phase-of-reagan-income-tax-cuts-take",
      "date": "1981-10-01",
      "date_precision": "day",
      "known_as_of": "1981-10-01",
      "category": "economics",
      "scope": "US",
      "headline": "First phase of Reagan income-tax cuts takes effect",
      "summary": "The initial reduction in the multi-stage federal income-tax cut becomes effective.",
      "tags": [
        "Reaganomics",
        "tax cuts"
      ],
      "economic_sectors": [
        "retail",
        "broad_market"
      ],
      "game_relevance": [
        "fiscal_policy",
        "consumer_spending"
      ],
      "importance": 4,
      "source_keys": [
        "wiki_1981"
      ]
    },
    {
      "id": "1981-10-06-egyptian-president-anwar-sadat-assassinate",
      "date": "1981-10-06",
      "date_precision": "day",
      "known_as_of": "1981-10-06",
      "category": "geopolitics",
      "scope": "Egypt",
      "headline": "Egyptian president Anwar Sadat assassinated",
      "summary": "Sadat is killed during a military parade, creating political uncertainty in a key Middle Eastern state.",
      "tags": [
        "Egypt",
        "Sadat",
        "Middle East"
      ],
      "economic_sectors": [
        "energy",
        "defense"
      ],
      "game_relevance": [
        "geopolitical_risk",
        "oil_price"
      ],
      "importance": 5,
      "source_keys": [
        "wiki_1981"
      ]
    },
    {
      "id": "1981-10-28-los-angeles-dodgers-win-world-series",
      "date": "1981-10-28",
      "date_precision": "day",
      "known_as_of": "1981-10-28",
      "category": "sports",
      "scope": "US",
      "headline": "Los Angeles Dodgers win World Series",
      "summary": "The Dodgers defeat the New York Yankees four games to two.",
      "tags": [
        "MLB",
        "World Series",
        "Dodgers"
      ],
      "economic_sectors": [
        "sports",
        "media"
      ],
      "game_relevance": [
        "sports_news"
      ],
      "importance": 2,
      "source_keys": [
        "wiki_us_1981"
      ]
    }
  ]
}