{
  "dataset": "project_bit_historical_timeline",
  "dataset_version": "0.1.0",
  "year": 1984,
  "month": 11,
  "period": "1984-11",
  "events": [
    {
      "id": "1984-11-06-ronald-reagan-wins-landslide-re-election",
      "date": "1984-11-06",
      "date_precision": "day",
      "known_as_of": "1984-11-06",
      "category": "politics",
      "scope": "US",
      "headline": "Ronald Reagan wins landslide re-election",
      "summary": "Reagan defeats Walter Mondale, carrying 49 states and winning 525 electoral votes.",
      "tags": [
        "Reagan",
        "Mondale",
        "election 1984"
      ],
      "economic_sectors": [
        "broad_market",
        "media"
      ],
      "game_relevance": [
        "election_cycle",
        "policy_continuity"
      ],
      "importance": 5,
      "source_keys": [
        "wiki_us_1984"
      ]
    },
    {
      "id": "1984-11-09-a-nightmare-on-elm-street-opens",
      "date": "1984-11-09",
      "date_precision": "day",
      "known_as_of": "1984-11-09",
      "category": "pop_culture",
      "scope": "US",
      "headline": "A Nightmare on Elm Street opens",
      "summary": "The horror film introduces Freddy Krueger and becomes an enduring franchise.",
      "tags": [
        "horror",
        "film",
        "Freddy Krueger"
      ],
      "economic_sectors": [
        "entertainment",
        "media"
      ],
      "game_relevance": [
        "consumer_trends",
        "period_flavor"
      ],
      "importance": 2,
      "source_keys": [
        "wiki_1984"
      ]
    },
    {
      "id": "1984-11-25-band-aid-records-do-they-know-it-s-christm",
      "date": "1984-11-25",
      "date_precision": "day",
      "known_as_of": "1984-11-25",
      "category": "pop_culture",
      "scope": "UK/international",
      "headline": "Band Aid records Do They Know It's Christmas?",
      "summary": "British and Irish music stars record a charity single to raise funds for Ethiopian famine relief.",
      "tags": [
        "Band Aid",
        "Ethiopia",
        "music"
      ],
      "economic_sectors": [
        "music",
        "media"
      ],
      "game_relevance": [
        "consumer_attention",
        "humanitarian"
      ],
      "importance": 4,
      "source_keys": [
        "wiki_1984"
      ]
    }
  ]
}