{
  "dataset": "project_bit_historical_timeline",
  "dataset_version": "0.1.0",
  "year": 1980,
  "month": 12,
  "period": "1980-12",
  "events": [
    {
      "id": "1980-12-08-john-lennon-is-murdered-in-new-york",
      "date": "1980-12-08",
      "date_precision": "day",
      "known_as_of": "1980-12-08",
      "category": "pop_culture",
      "scope": "US/international",
      "headline": "John Lennon is murdered in New York",
      "summary": "Former Beatle John Lennon is shot and killed outside his Manhattan residence, prompting worldwide mourning.",
      "tags": [
        "John Lennon",
        "Beatles",
        "music"
      ],
      "economic_sectors": [
        "music",
        "media"
      ],
      "game_relevance": [
        "period_flavor",
        "consumer_attention"
      ],
      "importance": 5,
      "source_keys": [
        "wiki_1980"
      ]
    },
    {
      "id": "1980-12-federal-funds-rates-approach-extreme-highs",
      "date": "1980-12",
      "date_precision": "month",
      "known_as_of": "1980-12",
      "category": "economics",
      "scope": "US",
      "headline": "Federal funds rates approach extreme highs",
      "summary": "The Federal Reserve's inflation fight pushes short-term interest rates toward historically high levels.",
      "tags": [
        "Volcker",
        "interest rates",
        "inflation"
      ],
      "economic_sectors": [
        "banking",
        "housing",
        "autos"
      ],
      "game_relevance": [
        "interest_rates",
        "credit_conditions"
      ],
      "importance": 5,
      "source_keys": [
        "fed_great_inflation"
      ]
    },
    {
      "id": "1980-12-home-computing-and-video-games-gain-moment",
      "date": "1980-12",
      "date_precision": "month",
      "known_as_of": "1980-12",
      "category": "technology",
      "scope": "US",
      "headline": "Home computing and video games gain momentum",
      "summary": "Personal computers, home consoles, and arcade games are becoming increasingly visible consumer technology categories entering the 1980s.",
      "tags": [
        "personal computers",
        "video games"
      ],
      "economic_sectors": [
        "technology",
        "retail"
      ],
      "game_relevance": [
        "tech_adoption",
        "consumer_trends"
      ],
      "importance": 2,
      "source_keys": [
        "wiki_1980"
      ]
    }
  ]
}